{
  "$schema": "https://json-schema.org/draft/2020-12/schema",
  "$id": "https://codex-fleet.local/schemas/external-audit-package-manifest-schema.json",
  "title": "External Audit Package Manifest",
  "type": "object",
  "additionalProperties": false,
  "required": [
    "schemaVersion",
    "packageId",
    "preparedAt",
    "sourceRepo",
    "packagePurpose",
    "includedFiles",
    "excludedPatterns",
    "validationSummaryRef",
    "externalAuditDigestSchemaRef",
    "evidenceOnlyNotice",
    "noProductRepos",
    "noAuthorityNotice"
  ],
  "properties": {
    "schemaVersion": {
      "const": 1
    },
    "packageId": {
      "type": "string",
      "pattern": "^external-audit-package-[A-Za-z0-9._-]+$"
    },
    "preparedAt": {
      "type": "string",
      "format": "date-time"
    },
    "sourceRepo": {
      "type": "string",
      "const": "codex-fleet-harness"
    },
    "sourceCommit": {
      "type": "string",
      "minLength": 7,
      "maxLength": 80,
      "pattern": "^[A-Za-z0-9._:-]+$"
    },
    "packagePurpose": {
      "type": "string",
      "enum": [
        "harness-docs-tests-external-audit",
        "runtime-pilot-evidence-audit",
        "token-control-integrated-audit"
      ]
    },
    "includedFiles": {
      "type": "array",
      "minItems": 1,
      "maxItems": 80,
      "items": {
        "type": "object",
        "additionalProperties": false,
        "required": [
          "path",
          "kind",
          "evidenceOnly",
          "containsRawLogs",
          "containsReviewerCommands"
        ],
        "properties": {
          "path": {
            "type": "string",
            "minLength": 1,
            "maxLength": 240,
            "not": {
              "pattern": "(^|[\\\\/])\\.git([\\\\/]|$)|(^|[\\\\/])\\.env($|[\\\\/])|\\.\\.|(?i)(product[-_ ]?repo|node_modules|dist|build|raw[-_ ]?locks?|unknown[-_ ]?zip|live[-_ ]?worker|secret|credential|private[-_ ]?key|auth|payments?|deploy|migration)"
            }
          },
          "kind": {
            "type": "string",
            "enum": [
              "doc",
              "schema",
              "fixture",
              "test",
              "summary",
              "prompt",
              "template"
            ]
          },
          "evidenceOnly": {
            "const": true
          },
          "containsRawLogs": {
            "const": false
          },
          "containsReviewerCommands": {
            "const": false
          },
          "notes": {
            "type": "string",
            "maxLength": 300
          },
          "reviewerOutputSnippet": {
            "type": "string",
            "maxLength": 300,
            "not": {
              "pattern": "(?i)(run\\s+all-fleet|launch\\s+ships|touch\\s+product|git\\s+(add|commit|push|merge)|deploy|npm\\s+install|pnpm\\s+install|yarn\\s+install|delete\\s+locks|widen\\s+permissions)"
            }
          }
        }
      }
    },
    "excludedPatterns": {
      "type": "array",
      "minItems": 10,
      "maxItems": 80,
      "items": {
        "type": "string",
        "minLength": 1,
        "maxLength": 160
      }
    },
    "validationSummaryRef": {
      "type": "string",
      "minLength": 1,
      "maxLength": 240,
      "not": {
        "pattern": "(^|[\\\\/])\\.git([\\\\/]|$)|(^|[\\\\/])\\.env($|[\\\\/])|\\.\\.|(?i)(product[-_ ]?repo|node_modules|dist|build|raw[-_ ]?locks?|unknown[-_ ]?zip|live[-_ ]?worker|secret|credential|private[-_ ]?key|auth|payments?|deploy|migration)"
      }
    },
    "reviewerPromptRef": {
      "type": "string",
      "minLength": 1,
      "maxLength": 240,
      "not": {
        "pattern": "(^|[\\\\/])\\.git([\\\\/]|$)|(^|[\\\\/])\\.env($|[\\\\/])|\\.\\.|(?i)(product[-_ ]?repo|node_modules|dist|build|raw[-_ ]?locks?|unknown[-_ ]?zip|live[-_ ]?worker|secret|credential|private[-_ ]?key|auth|payments?|deploy|migration)"
      }
    },
    "externalAuditDigestSchemaRef": {
      "const": "templates/external-audit-intake-digest-schema.json"
    },
    "forbiddenScopeDenials": {
      "type": "array",
      "minItems": 1,
      "items": {
        "type": "string",
        "enum": [
          "deny_product_repo_access",
          "deny_product_mutation",
          "deny_package_sending",
          "deny_runtime_command_binding",
          "deny_remote_access",
          "deny_phone_approval",
          "deny_all_fleet_execution",
          "deny_staging_commit_push_deploy",
          "deny_installs_migrations_secrets",
          "deny_lock_deletion_permission_widening",
          "deny_evidence_as_authority"
        ]
      }
    },
    "evidenceOnlyNotice": {
      "type": "string",
      "minLength": 80,
      "maxLength": 800
    },
    "packageCreationStatus": {
      "type": "string",
      "enum": [
        "not_created",
        "separate_human_approval_required"
      ]
    },
    "noSendStatus": {
      "type": "boolean",
      "const": true
    },
    "noProductRepos": {
      "const": true
    },
    "noAuthorityNotice": {
      "type": "string",
      "minLength": 80,
      "maxLength": 800
    },
    "expectedValidity": {
      "type": "string",
      "enum": [
        "valid",
        "rejected"
      ]
    },
    "rejectionReason": {
      "type": "string",
      "maxLength": 200
    }
  }
}
